tj,pers
Дувумин даври ин интихобот ҳам хурдодмоҳ баргузор шуд,دومین دور این انتخابات هم خرداد ماه برگزار شد
Ӯ аз,او از
нақши истисноии артиши Бритониё,نقش استثنایی ارتش بریتانیا
дар ин амалиёт тамҷид кард,در این عملیات تمجید کرد
аз Афғонистон хориҷ хоҳад кард,از افغانستان خارج خواهد کرد
"килуметрӣ то Исломободро бо худрав, комиюн ва мутур хоҳанд рафт",کیلومتری تا اسلام‌آباد را با خودرو ، کامیون و موتور خواهند رفت
Чандин гурӯҳи мӯътариз дар интернет шакл гирифтааст,چندین گروه معترض در اینترنت شکل گرفته است
Рӯзи якшанбе ҳудуди,روز یکشنبه حدود
"Шумо Келн ҳастед, инҷо ҷои нозиҳо нест",شما کلن هستید ، اینجا جای نازی‌ها نیست
ширкат карданд,شرکت کردند
СИКО,سیکا
Оқои Камерон ҷавонтарин нахуствазир аз соли,آقای کامرون جوان ترین نخست‌وزیر از سال
токунун аст,تاکنون است
Тони Блер ҳангоми расидан ба нахуствазирӣ дар соли,تونی بلر هنگام رسیدن به نخست وزیری در سال
шаш моҳ бузургтар буд,شش ماه بزرگتر بود
Созмони Ҷаҳонии Беҳдошт мегӯяд,سازمان جهانی بهداشت می‌گوید
нафар аз замони шуюъи эбуло ҷони худро аз даст додаанд,نفر از زمان شیوع ابولا جان خود را از دست داده‌اند
Бештари ин афрод сокини ғарби Офриқо буданд,بیشتر این افراد ساکن غرب آفریقا بودند
Ҷанги истиқлоли Банглодеш дар соли,جنگ استقلال بنگلادش در سال
Даҳҳо нафар ба табаъият аз ӯ дар майдони Тақсим истоданд,ده‌ها نفر به تبعیت از او در میدان تقسیم ایستادند
Оқои Башир дар бахши дигар аз суханонаш гуфт,آقای بشیر در بخش دیگری از سخنانش گفت
Мардуми Тунис имрӯз,مردم تونس امروز
дар аввалин интихоботи раёсати ҷумҳурии он кишвар аз замони,در اولین انتخابات ریاست جمهوری آن کشور از زمان
баҳори арабӣ,بهار عربی
дар соли,در سال
ширкат мекунанд,شرکت می‌کنند
"Оқои Меҳройин таъкид кард, ки масмумияти донишомӯзон ношӣ аз",آقای مهرآیین تاکید کرد که مسمومیت دانشآموزان ناشی از
сампошии амдӣ нест,سمپاشی عمدی نیست
ва саломати духтарон ҳам ҷойи нигаронӣ надорад,و سلامت دختران هم جای نگرانی ندارد
Оқои Масҷидҷомеъӣ дар ин интихобот бо касби,آقای مسجدجامعی در این انتخابات با کسب
ҳазору,هزار و
Нахустин моҳгирифтагии комили соли,نخستین ماه گرفتگی کامل سال
тавофуқи пойдори сиёсӣ,توافق پایدار سیاسی
кумак мекунад,کمک می‌کند
эълом кард,اعلام کرد
"Оқои Ҷонсун нагуфт, ки кадом гурӯҳ аз беш аз",آقای جانسون نگفت که کدام گروه از بیش از
маркази федерол шоҳиди ташдиди тадобири амниятӣ хоҳанд буд,مرکز فدرال شاهد تشدید تدابیر امنیتی خواهند بود
ҳам занони саъудӣ ва ҳам занони хориҷӣ,هم زنان سعودی و هم زنان خارجی
Гурӯҳи,گروه
Давлати исломӣ,دولت اسلامی
Ширкаткунандагон дар ин мусобиқа бояд,شرکت‌کنندگان در این مسابقه باید
ҳазор рубл барои ширкат дар он пардохт кунанд,هزار روبل برای شرکت در آن پرداخت کنند
баъзе масойилро рӯшан кунанд,بعضی مسایل را روشن کنند
Олмон дархости тамдиди воми Юнонро рад кард ва гуфт ин пешниҳодро,آلمان درخواست تمدید وام یونان را رد کرد و گفت این پیشنهاد را
қобили таваҷҷуҳ,قابل توجه
намедонад,نمی‌داند
Ҳамчунин дар соли,همچنین در سال
аз ҳар панҷ қурбонии қатл дар саросари ҷаҳон як нафар кӯдак будааст,از هر پنج قربانی قتل در سراسر جهان ، یک نفر کودک بوده است
Дар соли,در سال
Ӯ Доъишро таҳдиде барои Омрико тавсиф кард,او داعش را تهدیدی برای آمریکا توصیف کرد
"Агар касе Омрикоро таҳдид кунад, ҷойи амне нахоҳад ёфт",اگر کسی آمریکا را تهدید کند ، جای امنی نخواهد یافت
Ин тонкерҳо дар масири роҳи миёни Кобул ва Парвон дар наздикии,این تانکرها در مسیر راه میان کابل و پروان در نزدیکی
Багром,بگرام
мунфаҷир шудаанд,منفجر‌شده‌اند
"Ричард Вармо, сафири Омрико дар Ҳинд гуфт",ریچارد ورما سفیر آمریکا در هند گفت
Ориел Шорун дар соли,آریل شارون در سال
Ҷамъияти ин кишвар камтар аз ним миллиюн нафар аст,جمعیت این کشور کمتر از نیم میلیون نفر است
килуметр бо қудрати тахриби боло мунҳадим мекунад,کیلومتر با قدرت تخریب بالا منهدم می‌کند
"Муҳоҷимон оқои Хонро дар манзилаш, воқеъ дар Кортаи",مهاجمان ، آقای خان را در منزلش واقع در کارته
"дар ғарби Кобул, аз пой дароварданд",در غرب کابل ، از پای در آوردند
"Истивен Ҳорпер, нахуствазири Конодо, гуфт, ки кишвар",استیون هارپر نخست‌وزیر کانادا گفت که کشور
аз ин хушунат маръуб нахоҳад шуд,از این خشونت مرعوب نخواهد شد
Хонум Эспир дар соли,خانم اسپیر در سال
Бар асоси гузоришҳои дарёфтӣ баргузории кунсертҳо,براساس گزارش‌های دریافتی برگزاری کنسرت‌ها
ҷашнҳои хиёбонӣ,جشن‌های خیابانی
барпоии намоишгоҳ ва ҳамчунин қарор додани,برپایی نمایشگاهها و همچنین قرار دادن
Давлати Афғонистон мегӯяд ҳадаф аз баргузории ин иҷлос,دولت افغانستان می‌گوید هدف از برگزاری این اجلاس
Аз замони истиқлоли ду кишвари Ҳинд ва Покистон дар соли,از زمان استقلال دو کشور هند و پاکستان در سال
"Ширкат дар интихобот барои касоне, ки",شرکت در انتخابات برای کسانی که
"сол син доранд, дар Бразил иҷборӣ аст",سال سن دارند ، در برزیل اجباری است
Дар ин мубодила даҳ чатрбози асири русӣ дар муқобили,در این مبادله ، ده چترباز اسیر روسی در مقابل
сарбози укройнӣ озод шуданд,سرباز اوکراینی آزاد شدند
Лукзомбург кишваре кучак бо ҷамъияте болиғ бар,لوکزامبورگ کشوری کوچک با جمعیتی بالغ بر
ҳазор нафар аст,هزار نفر است
Дороиҳои бонкҳо ва соири муассисоти молии ин кишвар ба ҳудуди,دارایی‌های بانک‌ها و سایر موسسات مالی این کشور به حدود
баробари даромади миллии кишвар болиғ мешавад,برابر درآمد ملی کشور بالغ می‌شود
Раъйгирии рӯзи якшанбе барои интихоби,رای‌گیری روز یکشنبه برای انتخاب
узви Маҷлиси Муассион дар Тунис баргузор шуд,عضو مجلس موسسان در تونس برگزار شد
Ӯ гуфт фаластиниҳо бояд битавонанд бар асоси марзҳои соли,او گفت فلسطینی‌ها باید بتوانند بر اساس مرزهای سال
эъломи истиқлол кунанд,اعلام استقلال کنند
Оқои Карзай дар гуфтугӯ бо телевизиюни,آقای کرزی در گفتگو با تلویزیون
Ҷию,جیو
мегӯяд,می‌گوید
инфиъолӣ ва шитобзада,انفعالی و شتابزده
хонд ва гуфт,خواند و گفت
"Поп Жон Пули дувум, ки дар маросими имрӯз тақдис шуд, лаҳистонӣ буд",پاپ ژان پل دوم که در مراسم امروز تقدیس شد لهستانی بود
Ӯ то замони даргузашт дар соли,او تا زمان درگذشت در سال
сол дар мақоми поп калисои котуликро ҳидоят карда буд,سال در مقام پاپ کلیسای کاتولیک را هدایت کرده بود
Ҷош Фитол кӯҳнаварди,جاش فتال کوهنورد
-сола низ қарор аст дар маросими издивоҷ соқдӯш бошад,ساله نیز قرار است در مراسم ازدواج ساقدوش باشد
Селоби рӯзи гузашта дар шимоли Афғонистон боъиси марги дастикам,سیلاب روز گذشته در شمال افغانستان باعث مرگ دست کم
нафар шуд,نفر شد
Малик Абдуллоҳ сенздаҳумин писар дар миёни,ملک عبدالله ، سیزدهمین پسر در میان
писари Малик Абдулазиз буд,پسر ملک عبدالعزیز بود
Аз соли,از سال
ду кишвари Омрико ва Венезуэло сафире дар кишвари ҳам надоранд,دو کشور آمریکا و ونزوئلا سفیری در کشور هم ندارند
"Бар асоси ин гузориш пизишкон, парасторон ва равоншиносон дар",براساس این گزارش ، پزشکان ، پرستاران و روانشناسان در
шиканҷа ва дармонҳои ғайриинсонӣ ва иҳонатомези,شکنجه و درمان‌های غیرانسانی و اهانت آمیز
боздоштиҳо бо артиш ҳамкорӣ кардаанд,بازداشتی‌ها با ارتش همکاری کرده‌اند
Ин рақам ҳамчунин шаш милюн нафар бештар аз соли қабл аз он аст,این رقم ، همچنین شش میلیون نفر بیشتر از سال قبل از آن است
Келӣ Он боптист аз Тринидод ва Тубогу дар макони севум қарор гирифт,کلی آن باپتیست از ترینیداد و توباگو در مکان سوم قرار گرفت
Имсол чанд ширкати бузурги омрикоӣ ҳадафи ҳакерҳо қарор гирифтаанд,امسال چند شرکت بزرگ آمریکایی هدف هکرها قرار گرفته اند
Ин нерӯҳо шомили,این نیروها شامل
нерӯи вижаи фаронсавӣ ҳамроҳ бо сарбозони омрикоӣ ва афғон мешавад,نیروی ویژه فرانسوی همراه با سربازان آمریکایی و افغان می‌شود
Дуъои понкӣ,دعای پانکی
"-ро дар яке аз калисоҳои муҳими Маскав иҷро карданд, дар тобистони",را در یکی از کلیساهای مهم مسکو اجرا کردند ، در تابستان
ба далели,بدلیل
шарорати мубтанӣ бар нафрати мазҳабӣ,شرارت مبتنی بر نفرت مذهبی
дастгир шуданд,دستگیر شدند
Пулис мегӯяд бо шикастани дарҳо тавониста донишомӯзонро фарор диҳад,پلیس می‌گوید با شکستن در‌ها توانسته دانش آموزان را فراری دهد
Ҳилманд оромтарин вилояти ҷанубии Афғонистон аст,هلمند ناآرام‌ترین ولایت جنوبی افغانستان است
"Давлати Устролиё низ дар назар дорад, ки  беш аз як милёрду",دولت استرالیا نیز در نظر دارد که بیش از یک میلیارد و
сохтмони ин марказ ба оташ кашида шуд,ساختمان این مرکز به آتش کشیده شد
"Бино бар натоиҷи аввалия, аҳзоби",بنا بر نتایج اولیه ، احزاب
Эътилоф барои ҷумҳурӣ,ائتلاف برای جمهوری
Демукротики пешрав,دموکراتیک پیشرو
Кунгра барои ҷумҳурӣ,کنگره برای جمهوری
пас аз ҳизби Наҳзат дар маконҳои баъдӣ қарор доранд,پس از حزب نهضت ، در مکان‌های بعدی قرار دارند
Ӯ навишт,او نوشت
Ленин,لنین
Бигузор биафтад,بگذار بیفتد
то он ҷое ки мардум озор набинанд,تا آنجایی که مردم آزار نبینند
нафар дар ин шаҳр кушта шуданд,نفر در این شهر کشته شدند
Дастикам ёздаҳ тан аз мухолифон дар ин даргириҳо кушта шуданд,دست کم یازده تن از مخالفان در این درگیری‌ها کشته شدند
Давлати Исломӣ,دولت اسلامی
зарурист,ضروری است
Бобаки Занҷонӣ яке аз сармоягузорони аршади эронӣ дар Тоҷикистон буд,بابک زنجانی یکی از سرمایه‌گذاران ارشد ایرانی در تاجیکستان بود
"Ҳуқуқи маъмурони пулис, эҷоди маркази пулиси",حقوق ماموران پلیس ، ایجاد مرکز پلیس
Дар миёни кушташудагон ҳафт нафар ҳам аз нерӯҳои пулис ҳастанд,در میان کشته‌شدگان ، هفت نفر هم از نیروهای پلیس هستند
Маросими оташбозӣ низ ба муносибати интиқоли қудрат баргузор шуд,مراسم آتش بازی نیز به مناسبت انتقال قدرت برگزار شد
Ӯ ҳамчунин хоҳони гуфтугӯи мустақими тарфайни даргирӣ дар Укройн шуд,او همچنین خواهان گفت‌و‌گوی مستقیم طرفین درگیری در اوکراین شد
"моҳи май, камтар аз се моҳи дигар баргузор мешавад",ماه می‌، کمتر از سه ماه دیگر برگزار می‌شود
Ду кишвари Қазоқистон ва Узбакистон дар соли,دو کشور قزاقستان و ازبکستان در سال
тамдид карданд,تمدید کردند
Дар Узбакистон баргузории як реферондуми дигар дар соли,در ازبکستان برگزاری یک رفراندوم دیگر در سال
даври севуми раёсати ҷумҳурии Ислом Каримовро то соли,دور سوم ریاست جمهوری اسلام کریم اف را تا سال
тамдид кард,تمدید کرد
Ҳамакнун ҳудуди,هم اکنون حدود
ҳазор сарбози омрикоӣ дар Афғонистон ҳастанд,هزار سرباز آمریکایی در افغانستان هستند
Дар Урупо низ ин рухдод дар кишварҳои шимолии Искондиновӣ дида нашуд,در اروپا نیز این رخداد در کشورهای شمالی اسکاندیناوی دیده نشد
"Ӯ гуфт, ки нерӯҳои давлати Сумолӣ низ дар ин амалиёт ширкат доштанд",او گفت که نیروهای دولت سومالی نیز در این عملیات شرکت داشتند
Тойлонд аз соли,تایلند از سال
Суръати бодҳои тӯфони Несот то,سرعت بادهای توفان نسات تا
килуметр дар соъат гузориш шудааст,کیلومتر در ساعت گزارش‌شده‌است
Луҳонск дар шарқи Укройн ҳанӯз дар кунтрули ҷудоиталабон аст,لوهانسک در شرق اوکراین هنوز در کنترل جدایی‌طلبان است
Онҳо сипас як додгоҳ ва чанд сохтмони давлатиро ба оташ кашиданд,آن‌ها سپس یک دادگاه و چند ساختمان دولتی را به آتش کشیدند
Ин полоишгоҳ замоне,این پالایشگاه زمانی
дарсади нафти мавриди ниёзи Ироқро таъмин мекард,درصد نفت مورد نیاز عراق را تامین می‌کرد
Ин гурӯҳ як моҳ пас аз ташкил шудан амалиётеро дар Ҳалаб анҷом дод,این گروه یک ماه پس از تشکیل شدن عملیاتی را در حلب انجام داد
Ӯ ҳамчунин аз фаро хонда шудани сафири Конодо дар Маскав хабар дод,او همچنین از فراخوانده شدن سفیر کانادا در مسکو خبر داد
Давлати Исломии Ироқ ва Шом,دولت اسلامی عراق و شام
аз даст додааст,از دست داده است
Ҳамзамон бо оғози нишасти сарони кишварҳои узви Гурӯҳи,همزمان با آغاز نشست سران کشورهای عضو گروه
Боздошти оқои Мирондо таҳти қонуни зиддитерурисм анҷом гирифт,بازداشت آقای میراندا تحت قانون ضدتروریسم انجام گرفت
Имсол раъйгириҳо дар беш аз,امسال رای گیری‌ها در بیش از
ҳазор маркази раъйгирӣ анҷом хоҳад шуд,هزار مرکز رای‌گیری انجام خواهد شد
"Дар баъзе аз марокиз, дастгоҳҳои электруникии ахзи раъй насб шудааст",در بعضی از مراکز ، دستگاه‌های الکترونیکی اخذ رای نصب‌شده‌است
Пештар шоеъоте дар бораи эҳтимоли ин боздоштҳо мунташир шуда буд,پیش‌تر شایعاتی درباره احتمال این بازداشت‌ها منتشر‌شده‌بود
Як мақоми масъул дар шаҳри Санҷор,یک مقام مسئول در شهر سنجار
Шингол,شنگال
"дар шимоли ғарби Ироқ гуфт, ки бақоёои",در شمال غرب عراق گفت که بقایای
"мард, зан ва кӯдак дар ин қабри гурӯҳӣ пайдо шудааст",مرد ، زن و کودک در این قبر گروهی پیدا‌شده‌است
Поп Жони бисту сеюм мутаваллид Итолиё буд ва ба,پاپ ژان بیست و سوم متولد ایتالیا‌بود و به
Попи некӯ,پاپ نیکو
"шӯҳрат дошт, аз соли",شهرت داشت ، از سال
то замони даргузашт дар соли,تا زمان درگذشت در سال
раҳбари калисои котулик буд,رهبر کلیسای کاتولیک بود
Ӯ гуфт,او گفت
“Инҳо чи гуна машруъият пайдо карданд,اینها چگونه مشروعیت پیدا کردند
Оё мардуми Либи онҳоро интихоб карданд,آیا مردم لیبی آن‌ها را انتخاب کردند
Оё мардуми Либи онҳоро мансуб карданд,آیا مردم لیبی آن‌ها را منصوب کردند
"Моё Онҷилу, нависанда ва шоъири саршиноси омрикоӣ дар",مایا آنجلو ، نویسنده و شاعر سرشناس آمریکایی ، در
солагӣ даргузашт,سالگی درگذشت
Моҳи пеш беш аз дувист нафар дар хушунатҳои Ироқ кушта шуданд,ماه پیش بیش از دویست نفر در خشونت‌های عراق کشته شدند
"Аз Ироқ гузориш мерасад, ки пайкорҷӯёни Давлати исломии Ироқу Шом",از عراق گزارش می‌رسد که پیکارجویان دولت اسلامی عراق و شام
Доъиш,داعش
кунтрули дувумин шаҳри ин кишварро низ дар даст гирифтаанд,کنترل دومین شهر این کشور را نیز در دست گرفته‌اند
Ин се кишвар масъули бештарин мизони олудагӣ дар ҷаҳон ҳастанд,این سه کشور مسئول بیش‌ترین میزان آلودگی در جهان هستند
Тамдиди амалиёти НОТУ дар Либӣ бо мувофиқати,تمدید عملیات ناتو در لیبی با موافقت
узви ин паймон сурат гирифт,عضو این پیمان صورت گرفت
Парвиз Мушарраф аз соли,پرویز مشرف از سال
Биҷӣ дар шимоли Тикрит ва ҷануби ғарбии шаҳри Киркук қарор дорад,بیجی در شمال تکریت و جنوب غربی شهر کرکوک قرار داد
Дар пайи дастгирии Родувон Короҷич дар соли,در پی دستگیری رادوان کاراجیچ در سال
Ӯ меафзояд,او می‌افزاید
Даргириҳо дар пайи тирандозӣ ба ду офриқоӣ бо туфанги бодӣ шуруъ шуд,درگیری‌ها در پی تیراندازی به دو آفریقایی با تفنگ بادی شروع شد
Фурӯпошии Шуравии собиқ мунҷар ба истиқлоли чаҳордаҳ кишвар шуд,فروپاشی شوروی سابق منجر به استقلال چهارده کشور شد
Баҳои тило барои нахустин бор аз марзи,بهای طلا برای نخستین بار از مرز
дулор дар ҳар унс гузашт,دلار در هر اونس گذشت
Ҳазорон маъмури амниятӣ дар пойтахт мустақар шудаанд,هزاران مامور امنیتی در پایتخت مستقر‌شده‌اند
ҳазор нафар ҳам мубтало ҳастанд,هزار نفر هم مبتلا هستند
Ин як роҳи сода барои кумак ба кунтрули вазн аст,این یک راه ساده برای کمک به کنترل وزن است
"Влодимир Путин имрӯз, панҷшанбеи",ولادیمیر پوتین امروز ، پنجشنبه
Дар ҳамин ҳол бар асоси гузориши хабаргузории кори Эрон,در همین حال بر اساس گزارش خبرگزاری کار ایران
ИЛНО,ایلنا
"Кохи сафед, маҳали кор ва иқоматгоҳи расмии раиси ҷумҳури Омрико аст",کاخ سفید ، محل کار و اقامتگاه رسمی رئیس جمهور آمریکا است
"ЮНИСЕФ, аз кишварҳои ҷаҳон хоста, то бо ин амал мухолифат кунанд",یونیسف ، از کشورهای جهان خواسته تا با این عمل مخالفت کنند
Раъйдиҳандагон истиқболи чандоне аз интихобот накардаанд,رای‌دهندگان استقبال چندانی از انتخابات نکرده اند
"Дар маҷмӯъ, дар иҷрои қавонини ақимсозӣ дар",در مجموع ، در اجرای قوانین عقیم‌سازی در
иёлати Омрико ҳудуди,ایالت آمریکا ، حدود
ҳазор омрикоӣ ақим шуданд,هزار آمریکایی عقیم شدند
