tj,pers
ҳазоропоӣ дар ҳоли парвоз будааст,هزارپایی در حال پرواز بوده است
Гурӯҳи мавсум ба,گروه موسوم به
Чанд рӯз пеш мақомоти Ноту тадвини ин тарҳро эълом карданд,چند روز پیش ، مقامات ناتو تدوین این طرح را اعلام کردند
Ӯ рӯзи якшанбе ба Си-эн-эн гуфт,او روز یکشنبه به سی‌ان ان گفت
Инҳо одамҳое меҳанпараст ҳастанд ва гузориш,اینها آدم‌هایی میهن پرست هستند و گزارش
сено,سنا
"Раҳбарии ҳизби аслии мухолифи давлат, Ҳизби мардуми Ҳинд",رهبری حزب اصلی مخالف دولت ، حزب مردم هند
Бҳоротиё Ҷоното,بهاراتیا جاناتا
Ғанисозии урониюм ҷанҷолитарин бахши барномаи атомии Эрон аст,غنی‌سازی اورانیوم جنجالی ترین بخش برنامه اتمی ایران است
"имрӯз, якшанбе",امروز یکشنبه
парандаи ҳидоятпазир аз дур ё ҳавопаймои бидуни сарнишин,پرنده هدایت‌پذیر از دور ، یا هواپیمای بدون سرنشین
ва Муҳоҷир,و مهاجر
рӯнамоӣ шуд,رونمایی شد
Сухангӯйи низомиёни НОТУ ҳушдор дод,سخنگوی نظامیان ناتو هشدار داد
Сафири Сурия дар Лубнон низ чунин иқдомотеро маҳкум донистааст,سفیر سوریه در لبنان نیز چنین اقداماتی را محکوم دانسته است
хоҳони канорагирии ӯ аз қудрат шудаанд,خواهان کناره‌گیری او از قدرت شده‌اند
дар ҳоли тазъиф аст ва акнун вазъияти бисёр ошуфтае дорад,در حال تضعیف است و اکنون وضعیت بسیار آشفته‌ای دارد
Дар пайи ихроҷи раҳбари ҳизби,در پی اخراج رهبر حزب
Ҷамъият фарёд мезад,جمعیت فریاد می‌زد
Ин мақоми пулис гуфт,این مقام پلیس گفت
Сухангӯи идораи пулиси Ню Юрк гуфт,سخنگوی اداره پلیس نیویورک گفت
"адад коҳиш медиҳад, имзо карданд",عدد کاهش می‌دهد امضا کردند
эҳтимолан гоми муносибе хоҳад буд,احتمالا گام مناسبی خواهد بود
Ин музокирот дар остонаи конфаронси байналмилалии Сурия ба номи,این مذاکرات در آستانه کنفرانس بین‌المللی سوریه به نام
Женев,ژنو
"Вай афзуд, ки ҳадафи барномаи ҳастаии Ҷумҳурии Исломӣ",وی افزود که هدف برنامه هسته‌ای جمهوری اسلامی
пешрафти илмӣ,پیشرفت علمی
ва ғурури миллӣ аст ва афзуд,و غرور ملی است و افزود
Глен Гринволд дар мавриди раванди бозҷӯӣ аз партнери худ гуфт,گلن گرینوالد در مورد روند بازجویی از پارتنر خود گفت
"Ба гуфтаи сухангӯйи ин завҷ, дигар фарзандони онҳо, яъне Шилуи",به گفته سخنگوی این زوج ، دیگر فرزندان آن‌ها یعنی شیلو
-сола ҳомили ҳалйқаҳои издивоҷи онҳо буданд,ساله حامل حلقه‌های ازدواج آن‌ها بودند
Замоне қавонине мушобеҳ дар шуморе аз иёлатҳои Омрико иҷро мешуд,زمانی قوانینی مشاه در شماری از ایالت‌های آمریکا اجرا می‌شد
Ҷойи нигаронӣ нест,جای نگرانی نیست
"Исроил хонд, тарғиб кард",اسرائیل خواند را ترغیب کرد
бидуни таъхир як давлат,بدون تاخیر یک دولت
раъйи мухолиф тасвиб кард,رای مخالف تصویب کرد
"Оқои Убомо, дар рӯзномаи Ню Юрк Тоймз навишт",آقای اوباما در روزنامه نیویورک تایمز نوشت
Нахуствазири Итолиё афзуд ки ҳамкориҳои кишвараш пас аз,نخست‌وزیر ایتالیا افزود که همکاریهای کشورش پس از
Мехоҳам пешопеш ба оқои Сарвари Дониш,می‌خواهم پیشاپیش به آقای سرور دانش
муъовини дувуми Ашраф Ғанӣ Аҳмадзай,معاون دوم اشرف‌غنی احمدزی
"ки дар ин пирӯзӣ дар миёни шумост, табрик бигӯям",که در این پیروزی در میان شماست ، تبریک بگویم
наслкушӣ,نسل‌کشی
чунин рафторҳоеро комилан ғайриқобили қабул  медонад,چنین رفتارهایی را کاملا غیرقابل‌قبول می‌داند
Занони тағйир,زنان تغییر
аъзои доими Шурои Амният,اعضای دایم شورای امنیت
Мавқеъияти жеупулитики Укройн ҳам барои Омрико васвасакунанда аст,موقعیت ژئوپولتیک اوکراین هم برای آمریکا وسوسه‌کننده است
Марзҳои Укройн танҳо,مرزهای اوکراین تنها
килуметр то Маскав фосила доранд,کیلومتر تا مسکو فاصله دارند
гурехтаанд,گریخته‌اند
Қарор аст сарони кишварҳои дунё аввали меҳр,قرار است سران کشورهای دنیا اول مهر
Нахуствазири Исроил гуфт,نخست‌وزیر اسرائیل گفت
Дар ҷадвали соли,در جدول سال
"буд, ки дар соли ҷорӣ камтар шуда ва ҳокӣ аз афзоиши фасод аст",‌بود که در سال جاری کمتر‌شده‌و حاکی از افزایش فساد است
Хонум Клинтун дар кумитаи умури хориҷаи Маҷлиси Намояндагон гуфт,خانم کلینتون در کمیته امور خارجه مجلس نمایندگان گفت
Коршиносони мустақил ҳам иттиҳоми мушобеҳеро матраҳ мекунанд,کارشناسان مستقل هم اتهام مشابهی را مطرح می‌کنند
Ин интихобот бо ширкати се номзад баргузор мешавад,این انتخابات با شرکت سه نامزد برگزار می‌شود
"Мақомҳои эронӣ таъкид доштаанд, ки сомонаи С-",مقام‌های ایرانی تاکید داشته‌اند که سامانه اس -
ҷанбаи дифоъӣ дорад ва машмули таҳримҳои Созмони Милал намешаванд,جنبه دفاعی دارد و مشمول تحریم‌های سازمان ملل نمی‌شوند
Эрон бо ибрози нохурсандӣ аз тасмими Русия дар худдорӣ аз таҳвили С-,ایران با ابراز ناخرسندی از تصمیم روسیه در خودداری از تحویل اس -
аз шикоят дар ин замина ва талош барои дарёфти ғаромат хабар дода буд,از شکایت در این زمینه و تلاش برای دریافت غرامت خبر داده بود
рақиби мухолифи давлат ба ҷурми ширкат дар як,رقیب مخالف دولت به جرم شرکت در یک
роҳпаймоии ғайриқонунӣ,راهپیمایی غیرقانونی
Ва ё дар соли,و یا در سال
"Бояд сигорро тарк кунед, содатар аз ин намешавад",باید سیگار را ترک کنید ، ساده تر از این نمی‌شود
Дигар чи метавонам бигӯям,دیگر چه می‌توانم بگویم
мавриди эъдом дар соли,مورد اعدام در سال
Ин моҳвораҳо аз марказе низомӣ дар шимоли Чин ҳидоят мешаванд,این ماهواره‌ها از مرکزی نظامی در شمال چین هدایت می‌شوند
Ди-эн-эй,دی‌ان ای
ҳувияти ӯ таъйид шудааст,هویت او تایید‌شده‌است
лағв кард,لغو کرد
"сол дошта бошад, бо",سال داشته باشد با
Ӯ соли гузашта бо,او سال گذشته با
мувофиқ аз маҷмӯъи,موافق از مجموع
раъйи маъхуза раиси маҷлис шуда буд,رای ماخوذه رئیس مجلس‌شده‌بود
Мақомоти давлатӣ низ бо  ин гуна ҳаводис боэҳтиёт бархӯрд кардаанд,مقامات دولتی نیز با این‌گونه حوادث با احتیاط برخورد کرده اند
Ин пайкорҷӯён ағлаб аҳдофи низомиро мавриди ҳамла қарор медиҳанд,این پیکارجویان اغلب اهداف نظامی را مورد حمله قرار می‌دهند
Бузургтарин нигаронӣ тарс аз як ҷанги тасодуфӣ аст,بزرگ ترین نگرانی ، ترس از یک جنگ تصادفی است
Ин ҷанг аз ҷанги панҷрӯза дар Гурҷистон дар соли,این جنگ ، از جنگ پنج روزه در گرجستان در سال
ба маротиб хунинтар хоҳад буд,به مراتب خونین‌تر خواهد بود
Куреи Шимолӣ то кунун чандин мушаки ҳастаиро озмоиш кардааст,کره شمالی تاکنون چندین موشک هسته‌ای را آزمایش کرده است
нафарро захмӣ кардааст,نفر را زخمی کرده است
сангинтар шуд,سنگین تر شد
Укройн тамомии нерӯҳои захираи артишро ба хидмат фаро хондааст,اوکراین تمامی نیروهای ذخیره ارتش را به خدمت فراخوانده است
Бештари қурбониён аз сокинони Омрикои Лотин ва ҳавзаи Коройиб будаанд,بیشتر قربانیان از ساکنان آمریکای لاتین و حوزه کارائیب بوده‌اند
Раиси ҷумҳури Фаронса зимни таъкид бар зарурати вуҷуди таҳримҳо гуфт,رئیس جمهور فرانسه ضمن تاکید بر ضرورت وجود تحریم‌ها گفت
Оқои Путин қатли ӯро маҳкум карда ва қавли ёфтани қотилонро додааст,آقای پوتین قتل او را محکوم کرده و قول یافتن قاتلان را داده است
Як гузориши таъйиднашуда шумори куштаҳоро,یک گزارش تایید‌نشده‌شمار کشته‌ها را
моҳи гузашта дар Сурия боъиси сард шудани равобити ду кишвар шуда буд,ماه گذشته در سوریه باعث سرد شدن روابط دو کشور‌شده‌بود
"Умар Форуқ Абдулмуталаб, ки",عمر فاروق عبدالمطلب که
милюн бушка коҳиш пайдо кунад,میلیون بشکه کاهش پیدا کند
"Ин дар ҳоле аст, ки ду тараф машғули табодули усарои ҷангӣ ҳастанд",این در حالی است که دو طرف مشغول تبادل اسرای جنگی هستند
Дар вебсойти расмии Бонки марказии Чин омадааст,در وبسایت رسمی بانک مرکزی چین آمده است
Мухолифони ҳукумати Сурия мегӯянд беш аз,مخالفان حکومت سوریه می‌گویند بیش از
нафар дар эътирозҳои рӯзи якшанбе,نفر در اعتراض‌های روز یکشنبه
дар нуқоти мухталифи ин кишвар кушта шудаанд,در نقاط مختلف این کشور کشته شده‌اند
Ин систем беш аз,این سیستم بیش از
ҳазор бор бар ҳудуди,هزار بار بر حدود
Ҳатто хабарнигорон низ дар маърази ташаъшуъоти он қарор гирифтаанд,حتی خبرنگاران نیز در معرض تشعشعات آن قرار گرفته اند
Берлин пойтахти пуршукуҳ аммо вайрони,برلین ، پایتخت پرشکوه اما ویران
роиши севум,رایش سوم
"Иттиҳоди Шӯравӣ дар шарқ, Омрико, Бритониё ва Фаронса дар ғарб",اتحاد شوروی در شرق ، آمریکا و بریتانیا و فرانسه در غرب
"Ба гуфтаи Волерий Ҳелетей, вазири дифоъи Укройн, акнун",به گفته والری هلتی ، وزیر دفاع اوکراین ، اکنون
Порлумони Русия нахуствазирии Дмитрий Медведевро таъйид кардааст,پارلمان روسیه ، نخست وزیری دمیتری مدودف را تائید کرده است
Бо вуҷуди тасмими давлати Сурия ба ширкат дар иҷлоси Женев-,با وجود تصمیم دولت سوریه به شرکت در اجلاس ژنو -
бояд дар канори ҳукумати феълӣ дар давлати интиқолӣ ширкат кунанд,باید در کنار حکومت فعلی در دولت انتقالی شرکت کنند
Аз нигоҳи ӯ,از نگاه او
либеролҳои,لیبرال های
сарвати худро ба даст оварданд,ثروت خود را بدست آوردند
"-сола, мутааҳҳил ва дорои чаҳор фарзанд аст",ساله ، متاهل و دارای چهار فرزند است
Манобеъи давлат теъдоди кушташудагони ин рӯзро,منابع دولتی تعداد کشته‌شدگان این روز را
нафар эълом кардаанд,نفر اعلام کرده‌اند
Мо ҳар шаб ҳудуди як соъат бо ҳам суҳбат мекунем,ما هر شب حدود یک ساعت با هم صحبت می‌کنیم
Қаҳрамони кор,قهرمان کار
Ҷасади ин чаҳор нафар пеш аз судури баёния пайдо шуда буд,جسد این چهار نفر پیش از صدور بیانیه پیدا‌شده‌بود
ӯро лагадмол кунад,او را لگد مال کند
Тронсднестриё дар соли,ترانس‌نیستریا در سال
табдил шудааст,تبدیل‌شده‌است
"ҳам шинохта мешавад, ташкил диҳад",هم شناخته می‌شود ، تشکیل دهد
як таҳдиди айнӣ,یک تهدید عینی
"Самия Бахш, корманди бахши мунитуринги Би-би-сӣ мегӯяд",سمیه بخش ، کارمند بخش مونیتورینگ بی‌بی‌سی ، می‌گوید
"-килуметрии шимоли Бағдод, пойтахти Ироқ, воқеъ аст",کیلومتری شمال بغداد ، پایتخت عراق ، است
АйЭсАй,آی اس آی
ва гурӯҳи Алқоъида ҳимоят мешавад,و گروه القاعده حمایت می‌شود
"дарёфт кардаанд, башиддат мутаноқизанд",دریافت کرده‌اند به شدت متناقضند
имкони вуқуъи ҳар гуна эҳтимоле,امکان وقوع هر گونه احتمالی
-ро фароҳам мекунад,را فراهم می‌کند
Аз замоне ки Борок Убомо дар соли,از زمانی که باراک اوباما در سال
коҳиш ёфтааст,کاهش یافته است
дастикам,دست کم
нафар аз ҷумла,نفر از جمله
нерӯи амниятии давлатӣ кушта шуданд,نیروی امنیتی دولتی کشته شدند
миёни Афғонистону Омрико ба имзо расид,میان افغانستان و آمریکا به امضائ رسید
Бино бар ин баёния,بنا بر این بیانیه
хонаҳои бисёре вайрон шудааст,خانه‌های بسیاری ویران‌شده‌است
Сартип Борун дар нишасти хабарӣ дар Байтулмуқаддас гуфт,سرتیپ برون در نشستی خبری در بیت‌المقدس گفت
ҳимоят мекард,حمایت می‌کرد
байнобайнии,بینابینی
нуқтаи ғайриқобилибозгашти,نقطه غیرقابل بازگشت
ҷанги тамом айёр бо Русия наздик шудааст,جنگ تمام عیار با روسیه نزدیک‌شده‌است
Яке аз сухангӯёни Вазорати умури хориҷаи Омрико гуфтааст,یکی از سخنگویان وزارت امور خارجه آمریکا گفته است
"Фоту Бенсудо, додситони Девони байналмилалии кайфарӣ гуфтааст",فاطو بن سودا ، دادستان دیوان بین‌المللی کیفری گفته است
"дар кор ҳастанд, то монеъи як мусолиҳаи таърихӣ шаванд",در کار هستند تا مانع یک مصالحه تاریخی شوند
Ба гуфтаи сухангӯйи волии Лағмон,به گفته سخنگوی والی لغمان
ғайринизомии дигар ҳам дар пайи ин инфиҷор захмӣ шудаанд,غیرنظامی دیگر هم در پی این انفجار زخمی شده‌اند
Давлати Молӣ рӯзи,دولت مالی روز
Шомгоҳи панҷшанбе,شامگاه پنج‌شنبه
июн гузориш шуд як нафар дар ҷараёни эътирозҳо кушта шудааст,ژوئن گزارش شد یک نفر در جریان اعتراض‌ها کشته‌شده‌است
тан аз қурбониёни ин барнома ҳанӯз зинда ҳастанд,تن از قربانیان این برنامه هنوز زنده هستند
Давлати Эрон эълом кард ба хотири масоили,دولت ایران اعلام کرد به خاطر مسائل
башардӯстона,بشردوستانه
иҷоза дод ин мулоқот анҷом шавад,اجازه داد این ملاقات انجام شود
илқои ҳиси ғарқ шудан,القای حس غرق شدن
бо ҳамкории Алқоъида,با همکاری القاعده
ба як пойгоҳи низомии Урдун муттаҳам ва муҷрим шинохта шуд,به یک پایگاه نظامی اردن متهم ، و مجرم شناخته شد
Ин пойгоҳ маҳали сукунати сарбозони омрикоӣ буд,این پایگاه محل سکونت سربازان آمریکایی بود
Ӯ ҳоло озод аст ва машғули нафаргирӣ дар миёни ҷавонони урдунӣ аст,او حالا آزاد است و مشغول نفرگیری در میان جوانان اردنی است
Вазири хориҷаи Эрон рӯзи душанбе ҳамчунин ҳушдор дод,وزیر خارجه ایران روز دوشنبه همچنین هشدار داد
Оқои Луис дақоиқе баъд изофа кардааст,آقای لوئیس دقایقی بعد اضافه کرده است
Баҳори арабӣ ба нафъи Омрико тамом нашудааст,بهار عربی به نفع آمریکا تمام‌نشده‌است
Судон аз замони истиқлоли Судони Ҷанубӣ дар соли,سودان از زمان استقلال سودان جنوبی در سال
-сола пас аз интиқол ба бемористон ҷони худро аз даст дод,ساله پس از انتقال به بیمارستان جان خود را از دست داد
Шайх Ҳамад се ҳамсар ва дар маҷмӯъ ёздаҳ писару сенздаҳ духтар дорад,شیخ حمد سه همسر و در مجموع ، یازده پسر و سیزده دختر دارد
Оқои Керрӣ дар суханони имрӯзи худ гуфт,آقای کری در سخنان امروز خود گفت
Мо хостори оддисозии равобати байни ду кишвар,ما خواستار عادی‌سازی روابط بین دو کشور
Туркия ва Исроил,ترکیه و اسرائیل
Мо омодаи ин кор будем,ما آماده این کار بودیم
Хушунатҳо дар Ироқ дар соли гузашта ба болотарин ҳади худ аз соли,خشونت‌ها در عراق در سال گذشته به بالاترین حد خود از سال
мелодӣ расидааст,میلادی رسیده است
"дар ноҳияи Фархор, дар ҷануби Тоҷикистон, аст",در ناحیه فرخار در جنوب تاجیکستان است
Вай қаблан риёсати ширкати,وی قبلا ریاست شرکت
Голд Тур Транс,گولد تور ترانس
"Ин хок, ки ба номи хоки сиёҳ",این خاک که بنام خاک سیاه
ё сарзамини сиёҳ,یا سرزمین سیاه
Укройн соҳиби як чаҳорум аз хоки сиёҳи кураи замин аст,اوکراین صاحب یک چهارم از خاک سیاه کره زمین است
"Як сухангӯйи Пентогун таъйид кардааст, ки",یک سخنگوی پنتاگون تایید کرد هاست که
"нафаре, ки дар он ҷо боздошт ҳастанд, даст ба эътисоби ғизо задаанд",نفری که در آنجا بازداشت هستند دست به اعتصاب غذا زده‌اند
нафар дар ин марказ дар хоки Кубо дар эътисоб буданд,نفر در این مرکز در خاک کوبا در اعتصاب بودند
-и шомгоҳи рӯзи якшанбе то,شامگاه روز یکشنبه تا
-и бомдод идома дошт,بامداد ادامه داشت
Рӯзи чаҳоршанбе садои тирандозӣ дар шаҳри Дунетск ба гӯш мерасид,روز چهارشنبه صدای تیراندازی در شهر دونستک به گوش می‌رسید
Хонаводаи оқои Фулей дар Фейсбук навиштаанд,خانواده آقای فولی در فیس‌بوک نوشته‌اند
"Медонем, ки бисёре аз шумо ба дунболи посух ё таъйид ҳастед",می‌دانیم که بسیاری از شما به دنبال پاسخ یا تایید هستید
Хонаводаи Фулиро дар дуъоҳоятон фаромӯш накунед,خانواده فولی را در دعاهایتان فراموش نکنید
Чаҳор хохом ва як пулис дар миёни кушташудагон буданд,چهار خاخام و یک پلیس در میان کشته‌شدگان بودند
"Сухангӯи вазорати дифоъ таъкид дошта, ки боздошти ин афрод",سخنگوی وزارت دفاع تاکید داشته که بازداشت این افراد
аз Русия дархости паноҳандагии сиёсӣ кардааст,از روسیه درخواست پناهندگی سیاسی کرده است
муқаддастарин рӯзи мусулмонон,مقدس ترین روز مسلمانان
"-ро интихоб карданд, то",را انتخاب کردند تا
чеҳраи воқеъии худро нишон диҳанд,چهره واقعی خود را نشان دهند
Эрон ва Туркия дар бораи Сурия ихтилофи назари шадиде доранд,ایران و ترکیه درباره سوریه اختلاف‌نظر شدیدی دارند
"Таниши байни сунниҳо ва шиъиёни Ироқ, ки дар солҳои",تنش بین سنی‌ها و شیعیان عراق که در سال‌های
"ба авҷи худ расид, боъиси кушта шудани даҳҳо ҳазор нафар шудааст",به اوج خود رسید ، باعث کشته شدن ده‌ها هزار نفر‌شده‌است
соли гузашта камтар шудааст,سال گذشته کمتر‌شده‌است
Додгоҳе дар Колифорниёи Омрико зани,دادگاهی در کالیفرنیای آمریکا یک زن
Оқои Ҳомидулин дар ҷараёни аввалин ҳузур дар додгоҳ ҳарфи зиёде назад,آقای حامدولین در جریان اولین حضور در دادگاه حرف زیادی نزد
